{
  "id": "123456",
  "message": "example_value",
  "starts_at": "2026-04-17T12:00:00Z",
  "ends_at": "2026-04-17T12:00:00Z",
  "color": "example_value",
  "font": "example_value",
  "target_access_levels": "example_value",
  "target_path": "my-group/my-project",
  "broadcast_type": "example_value",
  "dismissable": "example_value"
}